{
  "$schema": "https://json-schema.org/draft/2020-12/schema",
  "$id": "https://spec.advfab.org/conformance/v1/result.schema.json",
  "type": "object",
  "required": ["schemaVersion", "implementation", "digest", "suite", "startedAt", "finishedAt", "tests"],
  "additionalProperties": false,
  "properties": {
    "schemaVersion": {"const": "conformance.advfab.org/v1"},
    "implementation": {"type": "string", "minLength": 1},
    "digest": {"type": "string", "pattern": "^sha256:[a-f0-9]{64}$"},
    "suite": {"const": "v1.0"},
    "startedAt": {"type": "string", "format": "date-time"},
    "finishedAt": {"type": "string", "format": "date-time"},
    "tests": {
      "type": "array",
      "minItems": 1,
      "items": {
        "type": "object",
        "required": ["id", "status"],
        "properties": {
          "id": {"type": "string"},
          "status": {"enum": ["pass", "fail", "skip"]},
          "reason": {"type": "string"}
        },
        "additionalProperties": false
      }
    }
  }
}
